{
  "$schema": "https://json-schema.org/draft/2020-12/schema",
  "$id": "https://example.local/forex-news-prediction-v2.schema.json",
  "title": "FOREX-NEWS-PREDICTIONS normalized prediction v2",
  "type": "object",
  "required": [
    "prediction_id",
    "created_at_utc",
    "event_time_utc",
    "eligible_for_hit_rate",
    "backfilled",
    "categories",
    "predictions"
  ],
  "properties": {
    "prediction_id": {"type": "string", "minLength": 1},
    "event_id": {"type": ["string", "null"]},
    "created_at_utc": {"type": "string", "format": "date-time"},
    "event_time_utc": {"type": "string", "format": "date-time"},
    "published_at_utc": {"type": ["string", "null"], "format": "date-time"},
    "model_version": {"type": ["string", "null"]},
    "prediction_model_version": {"type": ["string", "null"]},
    "methodology_version": {"type": ["string", "null"]},
    "eligible_for_hit_rate": {"type": "boolean"},
    "backfilled": {"type": "boolean"},
    "categories": {
      "type": "array",
      "minItems": 1,
      "items": {"type": "string"}
    },
    "evidence": {"$ref": "#/$defs/evidence"},
    "predictions": {
      "type": "array",
      "minItems": 1,
      "items": {"$ref": "#/$defs/instrumentPrediction"}
    },
    "market_context_at_prediction": {
      "type": "object",
      "properties": {
        "series": {"type": "object"},
        "regimes": {"type": "object"}
      },
      "additionalProperties": true
    }
  },
  "allOf": [
    {
      "if": {
        "properties": {"prediction_model_version": {"const": "2.0.0"}},
        "required": ["prediction_model_version"]
      },
      "then": {
        "required": ["evidence"],
        "properties": {
          "predictions": {
            "items": {
              "allOf": [
                {"$ref": "#/$defs/instrumentPrediction"},
                {"required": ["horizons", "counter_case", "technical_state"]}
              ]
            }
          }
        }
      }
    }
  ],
  "$defs": {
    "forecast": {
      "type": "object",
      "required": ["direction", "confidence"],
      "properties": {
        "direction": {
          "type": "string",
          "enum": ["UP", "DOWN", "MIXED", "VOLATILITY"]
        },
        "confidence": {"type": "number", "minimum": 1, "maximum": 10},
        "rationale": {"type": ["string", "null"]}
      },
      "additionalProperties": true
    },
    "horizons": {
      "type": "object",
      "required": ["15m", "1h", "4h", "next_session"],
      "properties": {
        "15m": {"$ref": "#/$defs/forecast"},
        "1h": {"$ref": "#/$defs/forecast"},
        "4h": {"$ref": "#/$defs/forecast"},
        "next_session": {"$ref": "#/$defs/forecast"}
      },
      "additionalProperties": false
    },
    "instrumentPrediction": {
      "type": "object",
      "required": ["instrument", "immediate"],
      "properties": {
        "instrument": {"type": "string", "minLength": 1},
        "immediate": {"$ref": "#/$defs/forecast"},
        "next_session": {"$ref": "#/$defs/forecast"},
        "horizons": {"$ref": "#/$defs/horizons"},
        "mechanism": {"type": ["string", "null"]},
        "invalidation": {"type": ["string", "null"]},
        "counter_case": {"type": ["string", "null"]},
        "technical_state": {
          "type": "object",
          "properties": {
            "reaction_since_event_pct": {"type": ["number", "null"]},
            "trend_5_15m": {"type": ["string", "null"]},
            "trend_1h": {"type": ["string", "null"]},
            "session_location": {"type": ["string", "null"]},
            "extension_state": {"type": ["string", "null"]},
            "market_open": {"type": ["boolean", "null"]}
          },
          "additionalProperties": true
        }
      },
      "additionalProperties": true
    },
    "evidence": {
      "type": "object",
      "required": [
        "article_role",
        "source_quality",
        "source_verified",
        "news_age_minutes",
        "novelty",
        "absorption",
        "cross_asset_confirmation",
        "dominant_driver",
        "attention"
      ],
      "properties": {
        "article_role": {
          "type": "string",
          "enum": ["NEW_CATALYST", "INCREMENTAL_UPDATE", "MARKET_RECAP", "COMMENTARY", "DATA_RELEASE"]
        },
        "source_quality": {"type": "string", "enum": ["PRIMARY", "TIER1", "SECONDARY", "UNKNOWN"]},
        "source_verified": {"type": "boolean"},
        "news_age_minutes": {"type": "number", "minimum": 0},
        "novelty": {"type": "string", "enum": ["HIGH", "MEDIUM", "LOW"]},
        "attention": {"type": "string", "enum": ["HIGH", "MEDIUM", "LOW", "UNKNOWN"]},
        "dominant_driver": {"type": "string", "minLength": 1},
        "surprise": {
          "type": ["object", "null"],
          "properties": {
            "actual": {},
            "consensus": {},
            "previous": {},
            "revised_previous": {},
            "surprise_direction": {"type": ["string", "null"]},
            "components": {"type": "object"}
          },
          "additionalProperties": true
        },
        "absorption": {
          "type": "object",
          "required": ["state"],
          "properties": {
            "state": {
              "type": "string",
              "enum": ["UNPRICED", "PARTIALLY_PRICED", "CONFIRMED_CONTINUATION", "FADED", "REVERSED", "NO_REACTION", "UNKNOWN"]
            },
            "reason": {"type": ["string", "null"]},
            "observed_reaction": {"type": "object"}
          },
          "additionalProperties": true
        },
        "cross_asset_confirmation": {
          "type": "object",
          "required": ["verdict"],
          "properties": {
            "verdict": {"type": "string", "enum": ["CONFIRMED", "CONFLICTING", "NEUTRAL", "UNKNOWN"]},
            "observations": {"type": "object"}
          },
          "additionalProperties": true
        },
        "decision_notes": {"type": ["string", "null"]}
      },
      "additionalProperties": true
    }
  },
  "additionalProperties": true
}
