{"event_id":"ff-1428060-iran-conflict-could-expand-indian-ocean","created_at_utc":"2026-09-24T09:07:43Z","event_time_utc":"2026-09-24T08:34:00Z","published_at_utc":"2026-09-24T08:34:00Z","eligible_for_hit_rate":true,"backfilled":false,"categories":["Iran","US","geopolitics","shipping","energy"],"prediction_id":"ff-1428060-iran-conflict-could-expand-indian-ocean-m1","model_version":"1.1.1","prediction_model_version":"1.1.1","methodology_version":"legacy","predictions":[{"instrument":"XAUUSD","relevance":"DIRECT","immediate":{"direction":"UP","confidence":6},"next_session":{"direction":"UP","confidence":5}},{"instrument":"SP500","relevance":"DIRECT","immediate":{"direction":"DOWN","confidence":6},"next_session":{"direction":"DOWN","confidence":5}},{"instrument":"NDX","relevance":"SECONDARY","immediate":{"direction":"DOWN","confidence":5},"next_session":{"direction":"DOWN","confidence":5}}]}