{"prediction_id":"ff-1418398-qeshm-explosions-m1","event_id":"ff-1418398-qeshm-explosions","created_at_utc":"2026-09-15T23:02:26Z","event_time_utc":"2026-09-15T22:06:00Z","published_at_utc":"2026-09-15T22:06:00Z","model_version":"1.1.1","prediction_model_version":"1.1.1","methodology_version":"legacy","eligible_for_hit_rate":true,"backfilled":false,"categories":["geopolitics","iran","oil-risk"],"predictions":[{"instrument":"SP500","immediate":{"direction":"DOWN","confidence":6,"rationale":"Fresh Iran escalation headline raises risk-off/oil premium."},"next_session":{"direction":"DOWN","confidence":5,"rationale":"Escalation risk can persist."}},{"instrument":"NDX","immediate":{"direction":"DOWN","confidence":6,"rationale":"Fresh Iran escalation headline raises risk-off/oil premium."},"next_session":{"direction":"DOWN","confidence":5,"rationale":"Escalation risk can persist."}},{"instrument":"XAUUSD","immediate":{"direction":"UP","confidence":6,"rationale":"Geopolitical safe-haven demand."},"next_session":{"direction":"UP","confidence":5,"rationale":"Safe-haven premium may persist."}}]}