{"event_id":"ff-1428055-boe-lombardelli-energy-inflation","created_at_utc":"2026-09-24T09:07:43Z","event_time_utc":"2026-09-24T08:05:43Z","published_at_utc":"2026-09-24T08:05:43Z","eligible_for_hit_rate":true,"backfilled":false,"categories":["UK","BoE","inflation","energy"],"prediction_id":"ff-1428055-boe-lombardelli-energy-inflation-m1","model_version":"1.1.1","prediction_model_version":"1.1.1","methodology_version":"legacy","predictions":[{"instrument":"UK100","relevance":"DIRECT","immediate":{"direction":"DOWN","confidence":6},"next_session":{"direction":"DOWN","confidence":5}}]}