{
  "prediction_id": "ff-20261001-ez-pmi-m2",
  "event_id": "ff-20261001-ez-pmi",
  "created_at_utc": "2026-10-01T08:54:16Z",
  "event_time_utc": "2026-10-01T08:02:00Z",
  "published_at_utc": "2026-10-01T08:02:00Z",
  "model_version": "2.0.0",
  "prediction_model_version": "2.0.0",
  "methodology_version": "3.0.0",
  "eligible_for_hit_rate": true,
  "backfilled": false,
  "categories": [
    "EUR",
    "PMI",
    "EQUITIES"
  ],
  "evidence": {
    "article_role": "DATA_RELEASE",
    "source_quality": "PRIMARY",
    "source_verified": true,
    "news_age_minutes": 52,
    "novelty": "HIGH",
    "attention": "MEDIUM",
    "dominant_driver": "Euro-area manufacturing expansion accelerated, with production and new orders strongest since early 2022.",
    "absorption": {
      "state": "FADED",
      "reason": "European equities remained under pressure as multi-year-high global yields dominated.",
      "observed_reaction": {
        "STOXX600": "about -1% in Reuters report",
        "DAX": "about -0.5% to -0.8% in contemporaneous reports"
      }
    },
    "cross_asset_confirmation": {
      "verdict": "CONFLICTING",
      "observations": {
        "US10Y": "5.3168% multi-decade high",
        "DXY": 101.777,
        "oil": "WTI/Brent falling but still elevated",
        "europe_equities": "lower"
      }
    },
    "decision_notes": "Residual-move forecast only; article is already partly priced. learning_profile contained no actionable rule."
  },
  "market_context_at_prediction": {
    "series": {
      "DXY": {
        "value": 101.777,
        "source": "WSJ/current-day"
      },
      "US2Y": {
        "value": 4.9,
        "source": "approx current-day market context"
      },
      "US10Y": {
        "value": 5.3168,
        "source": "Reuters/current-day"
      },
      "VIX": {
        "value": null,
        "source": "not reliably available at decision time"
      },
      "WTI": {
        "value": 89.1,
        "source": "Reuters/current-day"
      },
      "BRENT": {
        "value": 96.81,
        "source": "Reuters/current-day"
      }
    },
    "regimes": {
      "rates": "VERY_HIGH",
      "dollar": "FIRM",
      "oil": "ELEVATED_BUT_FALLING",
      "risk": "RISK_OFF_EUROPE"
    }
  },
  "predictions": [
    {
      "instrument": "GDAXI",
      "relevance": "DIRECT",
      "immediate": {
        "direction": "MIXED",
        "confidence": 4,
        "rationale": "Positive PMI is offset by yield-driven risk-off."
      },
      "next_session": {
        "direction": "MIXED",
        "confidence": 5,
        "rationale": "Requires yield stabilization for upside follow-through."
      },
      "horizons": {
        "15m": {
          "direction": "MIXED",
          "confidence": 4,
          "rationale": "Positive PMI is offset by yield-driven risk-off."
        },
        "1h": {
          "direction": "MIXED",
          "confidence": 4,
          "rationale": "Rates dominate current tape."
        },
        "4h": {
          "direction": "MIXED",
          "confidence": 5,
          "rationale": "Growth support may cushion but not reverse yield pressure."
        },
        "next_session": {
          "direction": "MIXED",
          "confidence": 5,
          "rationale": "Requires yield stabilization for upside follow-through."
        }
      },
      "mechanism": "PMI growth impulse versus discount-rate shock.",
      "counter_case": "Further rise in Bund/UST yields overwhelms growth signal.",
      "technical_state": {
        "reaction_since_event_pct": null,
        "trend_5_15m": "DOWN before/around article despite constructive PMI",
        "trend_1h": "DOWN",
        "session_location": "European cash session; major indices below prior close",
        "extension_state": "SELL-OFF PARTLY EXTENDED",
        "market_open": true,
        "source": "Reuters/WSJ current-day European market reports",
        "observed_at_utc": "2026-10-01T08:54:16Z"
      }
    },
    {
      "instrument": "FCHI40",
      "relevance": "DIRECT",
      "immediate": {
        "direction": "MIXED",
        "confidence": 4,
        "rationale": "PMI support versus risk-off."
      },
      "next_session": {
        "direction": "MIXED",
        "confidence": 5,
        "rationale": "No clean directional edge."
      },
      "horizons": {
        "15m": {
          "direction": "MIXED",
          "confidence": 4,
          "rationale": "PMI support versus risk-off."
        },
        "1h": {
          "direction": "MIXED",
          "confidence": 4,
          "rationale": "No clean confirmation."
        },
        "4h": {
          "direction": "MIXED",
          "confidence": 5,
          "rationale": "Higher yields and inflation pressure conflict with growth."
        },
        "next_session": {
          "direction": "MIXED",
          "confidence": 5,
          "rationale": "No clean directional edge."
        }
      },
      "mechanism": "Growth support versus rates.",
      "counter_case": "Yield shock persists.",
      "technical_state": {
        "reaction_since_event_pct": null,
        "trend_5_15m": "DOWN before/around article despite constructive PMI",
        "trend_1h": "DOWN",
        "session_location": "European cash session; major indices below prior close",
        "extension_state": "SELL-OFF PARTLY EXTENDED",
        "market_open": true,
        "source": "Reuters/WSJ current-day European market reports",
        "observed_at_utc": "2026-10-01T08:54:16Z"
      }
    },
    {
      "instrument": "STOXX50",
      "relevance": "DIRECT",
      "immediate": {
        "direction": "MIXED",
        "confidence": 4,
        "rationale": "PMI positive but absorbed."
      },
      "next_session": {
        "direction": "MIXED",
        "confidence": 5,
        "rationale": "Upside needs yields to ease."
      },
      "horizons": {
        "15m": {
          "direction": "MIXED",
          "confidence": 4,
          "rationale": "PMI positive but absorbed."
        },
        "1h": {
          "direction": "MIXED",
          "confidence": 4,
          "rationale": "Cross-asset conflict."
        },
        "4h": {
          "direction": "MIXED",
          "confidence": 5,
          "rationale": "Rates remain dominant."
        },
        "next_session": {
          "direction": "MIXED",
          "confidence": 5,
          "rationale": "Upside needs yields to ease."
        }
      },
      "mechanism": "Growth support versus rates.",
      "counter_case": "Yields continue rising.",
      "technical_state": {
        "reaction_since_event_pct": null,
        "trend_5_15m": "DOWN before/around article despite constructive PMI",
        "trend_1h": "DOWN",
        "session_location": "European cash session; major indices below prior close",
        "extension_state": "SELL-OFF PARTLY EXTENDED",
        "market_open": true,
        "source": "Reuters/WSJ current-day European market reports",
        "observed_at_utc": "2026-10-01T08:54:16Z"
      }
    },
    {
      "instrument": "SPA35",
      "relevance": "SECONDARY",
      "immediate": {
        "direction": "MIXED",
        "confidence": 4,
        "rationale": "Regional PMI positive but rates negative."
      },
      "next_session": {
        "direction": "MIXED",
        "confidence": 4,
        "rationale": "Secondary relevance."
      },
      "horizons": {
        "15m": {
          "direction": "MIXED",
          "confidence": 4,
          "rationale": "Regional PMI positive but rates negative."
        },
        "1h": {
          "direction": "MIXED",
          "confidence": 4,
          "rationale": "No clean confirmation."
        },
        "4h": {
          "direction": "MIXED",
          "confidence": 4,
          "rationale": "Secondary relevance."
        },
        "next_session": {
          "direction": "MIXED",
          "confidence": 4,
          "rationale": "Secondary relevance."
        }
      },
      "mechanism": "Regional growth spillover.",
      "counter_case": "Rates dominate.",
      "technical_state": {
        "reaction_since_event_pct": null,
        "trend_5_15m": "DOWN before/around article despite constructive PMI",
        "trend_1h": "DOWN",
        "session_location": "European cash session; major indices below prior close",
        "extension_state": "SELL-OFF PARTLY EXTENDED",
        "market_open": true,
        "source": "Reuters/WSJ current-day European market reports",
        "observed_at_utc": "2026-10-01T08:54:16Z"
      }
    }
  ]
}
